{
  "id": "re-qc-quebec-cma-cmhc-vacancy-2025-10",
  "category": "re",
  "subcategory": "rental market survey",
  "name": "Québec — CMHC purpose-built apartment vacancy rate, October 2025",
  "name_fr": null,
  "geo": {
    "province": "QC",
    "region": null,
    "city": "Québec",
    "neighbourhood": null,
    "address": null,
    "coord_precision": "unknown",
    "coord_source": null
  },
  "description": "Share of privately initiated purpose-built rental apartment units in Québec CMA that were vacant and available for immediate rental in October 2025 (CMHC Rental Market Survey).",
  "attributes": {
    "metric": "vacancy_rate",
    "property_type": "purpose_built_rental",
    "bedrooms": "all",
    "value": 2.4,
    "unit": "percent",
    "period": "2025-10",
    "geography_level": "cma",
    "geography_name": "Québec CMA",
    "figure_kind": "survey",
    "sample_size": null,
    "year_over_year_change_pct": null,
    "notes": "Private apartment vacancy rate, all bedroom types: October 2024 0.9%, October 2025 2.4% (quality 'a'). Two-bedroom only: 1.0% → 2.5% (quality 'a'). year_over_year_change_pct left null because the change is in percentage points."
  },
  "data_kind": "official_fact",
  "sources": [
    {
      "url": "https://assets.cmhc-schl.gc.ca/sites/cmhc/professional/housing-markets-data-and-research/housing-data-tables/rental-market/rental-market-report-data-tables/2025/rmr-quebec-cma-2025-en.xlsx",
      "title": "Rental Market Survey Data Tables, Québec CMA, 2025 (Table 1.1.1)",
      "publisher": "Canada Mortgage and Housing Corporation (CMHC)",
      "source_type": "housing_agency",
      "accessed": "2026-10-30",
      "data_period": "2025-10",
      "methodology": "CMHC Rental Market Survey, October 2025: privately initiated purpose-built rental apartment structures of three or more units; survey of landlords/property managers; quality grades a–d, ** = suppressed.",
      "licence": "© Canada Mortgage and Housing Corporation. CMHC Terms and Conditions (https://www.cmhc-schl.gc.ca/about-us/terms-conditions): content may be copied, downloaded and printed for personal use; it may not otherwise be redistributed, republished or reproduced without CMHC's prior written consent. The same average-rent figures are republished by Statistics Canada (table 34-10-0133-01) under the Statistics Canada Open Licence."
    },
    {
      "url": "https://www150.statcan.gc.ca/t1/tbl1/en/tv.action?pid=3410013001",
      "title": "Table 34-10-0130-01, CMHC vacancy rates, row and apartment structures of three units and over, CMAs — Québec, Quebec (vector v1930316)",
      "publisher": "Statistics Canada",
      "source_type": "statistics_agency",
      "accessed": "2026-10-30",
      "data_period": "2025",
      "methodology": "Row-and-apartment vacancy rate (broader than the apartment-only figure stored here); 2025 value 2.4%.",
      "licence": "Statistics Canada Open Licence (https://www.statcan.gc.ca/en/reference/licence); attribution 'Source: Statistics Canada' required."
    }
  ],
  "units": null,
  "verification": {
    "status": "verified",
    "confidence": "high",
    "verified_by": "agent-02",
    "last_verified": "2026-10-30",
    "next_review": "2026-12-29",
    "notes": "Value read from the CMHC Excel data table downloaded on 2026-10-30."
  },
  "responsible_agent": "agent-02",
  "limitations": "Vacancy measures units vacant and ready to rent on the survey date; it excludes condominium rentals and secondary market units. A low rate signals a tight market but says nothing about asking rents.",
  "created": "2026-10-30",
  "updated": "2026-10-30"
}
