{
  "id": "re-on-ottawa-hpi-composite-2026-09",
  "category": "re",
  "subcategory": "mls home price index",
  "name": "MLS® HPI 'OTTAWA' — composite benchmark price, September 2026",
  "name_fr": null,
  "geo": {
    "province": "ON",
    "region": null,
    "city": "Ottawa",
    "neighbourhood": null,
    "address": null,
    "coord_precision": "unknown",
    "coord_source": null
  },
  "description": "MLS® Home Price Index composite benchmark price for CREA MLS® HPI market 'OTTAWA' (board-defined market area; boundaries differ from the Statistics Canada CMA), September 2026. Benchmark = modelled price of a typical home across all property types; used here as the price reference for the Ottawa profile.",
  "attributes": {
    "metric": "benchmark_price",
    "property_type": "all",
    "bedrooms": null,
    "value": 623500,
    "unit": "cad",
    "period": "2026-09",
    "geography_level": "zone",
    "geography_name": "CREA MLS® HPI market 'OTTAWA' (board-defined market area; boundaries differ from the Statistics Canada CMA)",
    "figure_kind": "index",
    "sample_size": null,
    "year_over_year_change_pct": -0.3,
    "notes": "MLS® HPI composite benchmark, not seasonally adjusted. September 2025: $625,400; September 2026: $623,500. year_over_year_change_pct computed by agent-02 from these two CREA values. 5-year annualised change (Sept 2021→Sept 2026): 0.8%; 10-year: 5.8%; peak benchmark 703,100 in 2022-03, now -11.3% from peak (all computed by agent-02 from the same CREA series, nominal)."
  },
  "data_kind": "official_fact",
  "sources": [
    {
      "url": "https://www.crea.ca/files/mls-hpi-data/MLS_HPI_Oct_2026.zip",
      "title": "MLS® Home Price Index data download (Not Seasonally Adjusted, monthly), sheet OTTAWA",
      "publisher": "The Canadian Real Estate Association (CREA)",
      "source_type": "real_estate_board",
      "accessed": "2026-10-30",
      "data_period": "2026-09",
      "methodology": "MLS® HPI benchmark: price of a typical (benchmark) home whose attributes are held constant, estimated from completed MLS® sales; index 2005-01 = 100; methodology briefing at https://www.crea.ca/files/mls-hpi-data/english/Briefing-on-changes-to-HPI-methodology-ENG.pdf. Not seasonally adjusted series used.",
      "licence": "© The Canadian Real Estate Association (CREA) and/or the supplying board. MLS® HPI data terms shown on the CREA HPI tool page: private, non-commercial use; may be used for reference, analyses and reporting of results with CREA attributed; the content itself may not be published or displayed in whole or in part, modified, merged or redistributed without CREA's prior written consent. MLS® and MLS® HPI are CREA trademarks."
    },
    {
      "url": "https://www.crea.ca/housing-market-stats/mls-home-price-index/hpi-tool/",
      "title": "MLS® HPI tool and data terms of use",
      "publisher": "The Canadian Real Estate Association (CREA)",
      "source_type": "real_estate_board",
      "accessed": "2026-10-30",
      "data_period": null,
      "methodology": null,
      "licence": "© The Canadian Real Estate Association (CREA) and/or the supplying board. MLS® HPI data terms shown on the CREA HPI tool page: private, non-commercial use; may be used for reference, analyses and reporting of results with CREA attributed; the content itself may not be published or displayed in whole or in part, modified, merged or redistributed without CREA's prior written consent. MLS® and MLS® HPI are CREA trademarks."
    }
  ],
  "units": null,
  "verification": {
    "status": "verified",
    "confidence": "high",
    "verified_by": "agent-02",
    "last_verified": "2026-10-30",
    "next_review": "2026-12-29",
    "notes": "Value read from CREA's MLS_HPI_Oct_2026.zip (data through September 2026), downloaded 2026-10-30; the national aggregate's -3.4% year-over-year matches CREA's 16 October 2026 release."
  },
  "responsible_agent": "agent-02",
  "limitations": "Benchmark price of a modelled typical home from completed MLS® sales; not an average or median of sales and not an asking price. Board market areas do not match Statistics Canada CMA boundaries. Monthly NSA values move with season and sales mix; CREA may revise back-series at its annual review. CREA's terms restrict republication: the map must link to or retrieve this figure on demand rather than display a stored copy (see METHODOLOGY.md).",
  "created": "2026-10-30",
  "updated": "2026-10-30"
}
