{
  "id": "nat-ca-express-entry-crs-changes-2026-11-03",
  "category": "nat",
  "subcategory": "immigration",
  "name": "Express Entry ranking changes effective 3 November 2026 (job offers and Canadian experience)",
  "name_fr": "Changements au système de classement de l'Entrée express au 3 novembre 2026",
  "geo": {
    "province": "CA",
    "region": null,
    "city": null,
    "neighbourhood": null,
    "address": null,
    "lat": null,
    "lon": null,
    "coord_precision": "unknown",
    "coord_source": null,
    "extent": "country"
  },
  "description": "From 3 November 2026 Express Entry adds a 'labour market integration' factor that gives points for either Canadian work experience or a qualifying job offer (whichever is higher), rewards high-wage occupations, and no longer requires an LMIA for a job offer to count.",
  "attributes": {
    "jurisdiction": "federal (IRCC)",
    "legal_status": "announced; in force from 2026-11-03 (four days after the access date)",
    "effective_date": "2026-11-03",
    "labour_market_integration_max": "150 without an accompanying spouse; 140 with",
    "canadian_work_experience_points": "work-length points unchanged (35–70 with spouse, 40–80 without, for 1 to 5+ years) plus high-wage bonus of 70 / 40 / 20 where the occupation's national median wage is at least 2.0x / 1.5x / 1.3x the average median wage, after at least 12 months (1,560 h) in high-wage occupations",
    "job_offer_points": "100 / 70 / 50 for a qualifying offer in an occupation at 2.0x / 1.5x–2.0x / 1.3x–1.5x the average median wage; 0 below 1.3x",
    "lmia": "No longer required for a job offer to count for programme eligibility or CRS points; an LMIA adds no points; officers assess genuineness. The online profile still asks for a positive LMIA until updated (placeholder details on the IRCC page).",
    "fsw_fst_job_offers": "For programme eligibility, offers may be in any eligible TEER 0–3 job, not only high-wage occupations",
    "transition": "Profiles are recalculated on 3 November 2026 (up to two weeks); invitation rounds pause meanwhile. Candidates must update profiles before 3 November to receive job-offer points.",
    "status_dependency": "Matters only if the user has Canadian work experience or a Canadian job offer — both unknown (USER-PROFILE.md 'Work mode', 'Occupation')."
  },
  "data_kind": "official_fact",
  "sources": [
    {
      "url": "https://www.canada.ca/en/immigration-refugees-citizenship/services/immigrate-canada/express-entry/changes.html",
      "title": "2026 changes to points for Canadian work experience and job offers in the Express Entry system (modified 2026-10-16)",
      "publisher": "Immigration, Refugees and Citizenship Canada",
      "source_type": "federal_government",
      "accessed": "2026-10-30",
      "data_period": "effective 2026-11-03",
      "methodology": null,
      "licence": "Open Government Licence – Canada"
    },
    {
      "url": "https://www.canada.ca/en/immigration-refugees-citizenship/news/2026/10/canada-refocusing-express-entry-on-top-talent-that-drives-economic-growth.html",
      "title": "Canada refocusing Express Entry on top talent that drives economic growth (news release, October 2026; via search extract)",
      "publisher": "Immigration, Refugees and Citizenship Canada",
      "source_type": "federal_government",
      "accessed": "2026-10-30",
      "data_period": "2026",
      "methodology": null,
      "licence": "Open Government Licence – Canada"
    },
    {
      "url": "https://www.canada.ca/en/immigration-refugees-citizenship/services/immigrate-canada/express-entry/eligibility/criteria-comprehensive-ranking-system/grid.html",
      "title": "Comprehensive Ranking System criteria grid (modified 2026-10-16)",
      "publisher": "Immigration, Refugees and Citizenship Canada",
      "source_type": "federal_government",
      "accessed": "2026-10-30",
      "data_period": null,
      "methodology": null,
      "licence": "Open Government Licence – Canada"
    }
  ],
  "units": null,
  "verification": {
    "status": "verified",
    "confidence": "high",
    "verified_by": "agent-01",
    "last_verified": "2026-10-30",
    "next_review": "2026-11-29",
    "notes": "IRCC changes page fetched directly; the release was read through a search extract. Wording of wage thresholds differs slightly between the release ('median wage') and the changes page ('average median wage'); the changes page is used."
  },
  "responsible_agent": "agent-01",
  "limitations": "The list of occupations that qualify as high-wage was not captured. Re-check after 3 November 2026 that the change took effect as announced.",
  "created": "2026-10-30",
  "updated": "2026-10-30"
}
