{
  "id": "nat-ab-education-independent-schools-and-home-education",
  "category": "nat",
  "subcategory": "education regulation — private schools, home education",
  "name": "Alberta — independent (private) schools and home education",
  "name_fr": null,
  "geo": {
    "province": "AB",
    "region": null,
    "city": null,
    "neighbourhood": null,
    "address": null,
    "lat": null,
    "lon": null,
    "coord_precision": "unknown",
    "coord_source": null,
    "extent": "province-wide"
  },
  "description": "Alberta's Education Act recognises registered independent schools (no funding, no certificated-teacher or programs-of-study requirement), accredited non-funded schools (certificated teachers) and accredited funded schools (certificated teachers, Alberta programs of study, leadership-certified principal, annual monitoring). Home education is either supervised by a willing school authority (funded; parents may claim 50% of the home-education grant; two teacher evaluations per year) or notification-only to the Minister (unfunded).",
  "attributes": {
    "legal_term": "Independent school (formerly 'private school'), Education Act ss.29(1)–(2) and Private Schools Regulation",
    "categories": {
      "registered": "Section 29(1); not eligible for funding; certificated teachers and Alberta programs of study not required, but must keep subject list and outline consistent with Ministerial learning requirements.",
      "accredited_non_funded": "Section 29(2); certificated teachers required; programs of study not required.",
      "accredited_funded": "Grant under the Education Grants Regulation after (normally) one unfunded year; Alberta programs of study; principal with Leadership Quality Standard certificate; annual monitoring of plans, budgets, audited statements and results reports; on-site monitoring visits."
    },
    "funding_level": "Operating funding commonly reported as about 70% of public base instruction rates (secondary sources: Cardus 2023, Fraser Institute) — not confirmed on alberta.ca; transportation funding 70% of public rate Gr 1–12 and 100% ECS (alberta.ca).",
    "annual_obligations": "All registered and accredited schools submit an operating plan by 15 May each year.",
    "home_education": {
      "supervised": "Notify a willing public, separate, francophone board or accredited funded independent school each year; accepted before 30 September for funding; parents may access their portion (50%) of the home-education grant for up to two years; the authority arranges at least two formal evaluations by certificated teachers per year.",
      "notification_only": "Notify the Minister (form or PASI/myPass); no program plan submission; no funding.",
      "kindergarten_pilot": "Extended to end of 2026/27; half of the full-day home-education rate each to authority and guardians."
    },
    "diploma": "Not addressed on the alberta.ca private-schools page; the Alberta High School Diploma depends on Alberta credits — to be confirmed per school.",
    "online": "Independent authorities may offer online learning (directory flag 'Offers Online Learning'); detailed rules not researched in Phase 1."
  },
  "data_kind": "official_fact",
  "sources": [
    {
      "url": "https://www.alberta.ca/private-schools",
      "title": "Independent (private) schools",
      "publisher": "Government of Alberta",
      "source_type": "provincial_government",
      "accessed": "2026-10-30"
    },
    {
      "url": "https://www.alberta.ca/home-education",
      "title": "Home education",
      "publisher": "Government of Alberta",
      "source_type": "provincial_government",
      "accessed": "2026-10-30"
    },
    {
      "url": "https://www.cardus.ca/wp-content/uploads/2023/05/2023-02-23_Policy-Brief-AB-Ed-Indie-School-Year-1-Funding_FINAL.pdf",
      "title": "Policy brief: Alberta independent school year-1 funding (2023)",
      "publisher": "Cardus",
      "source_type": "industry_report",
      "accessed": "2026-10-30"
    },
    {
      "url": "https://education.alberta.ca/media/1626669/authority_and_school.xlsx",
      "title": "School and Authority Information Report (authority_and_school.xlsx, extract date 2026-10-28)",
      "publisher": "Alberta Education and Childcare",
      "source_type": "provincial_government",
      "accessed": "2026-10-30"
    }
  ],
  "units": null,
  "verification": {
    "status": "partially_verified",
    "confidence": "medium",
    "verified_by": "agent-03",
    "last_verified": "2026-10-30",
    "next_review": "2027-04-30",
    "notes": "Categories and home-education rules read on alberta.ca; the 70% funding rate is from secondary sources only."
  },
  "limitations": "Funding percentage unconfirmed from government text; diploma rules for independent schools not stated on the pages read.",
  "responsible_agent": "agent-03",
  "created": "2026-10-30",
  "updated": "2026-10-30"
}
