{
  "id": "nat-qc-francisation-quebec",
  "category": "nat",
  "subcategory": "language",
  "name": "Quebec: Francisation Québec French courses for newcomers",
  "name_fr": "Québec : cours de français de Francisation Québec",
  "geo": {
    "province": "QC",
    "region": null,
    "city": null,
    "neighbourhood": null,
    "address": null,
    "lat": null,
    "lon": null,
    "coord_precision": "unknown",
    "coord_source": null,
    "extent": "province or territory"
  },
  "description": "Francisation Québec, created by Bill 96, is the single government access point for learning French. Courses are free for immigrants aged 16+ living in Quebec, including temporary workers, with financial assistance for full-time study.",
  "attributes": {
    "jurisdiction": "Quebec",
    "legal_status": "in force",
    "eligibility_full_time_immigrants": "Born outside Canada, 16 or older, living in Quebec; people planning to settle may also access services",
    "temporary_residents": "Temporary workers may register for full- or part-time courses; temporary students only if enrolled in a recognised programme as main occupation",
    "cost": "Free tuition and admission; small fees possible for materials or outings",
    "format": "Full-time sessions of 10 weeks at 25–30 hours per week; part-time and fully online options; free beginner platform francais-enligne.quebec",
    "financial_assistance": "Incentive assistance for full-time courses; none for individual part-time participants since 23 September 2024; none for fully online courses",
    "obligation": "No general legal obligation on individual newcomers to take courses was identified; French requirements arise through immigration selection (see nat-qc-skilled-worker-selection-program) and the six-month service rule (nat-qc-public-services-language).",
    "status_dependency": "Matters only if Quebec is in scope (USER-PROFILE.md: 'English-only vs bilingual environment' unknown) and depends on the user's status and French ability (unknown)."
  },
  "data_kind": "official_fact",
  "sources": [
    {
      "url": "https://www.quebec.ca/en/education/learn-french/full-time-courses/immigrants/description",
      "title": "Description of full-time French courses for immigrants (via search extract)",
      "publisher": "Gouvernement du Québec (Francisation Québec)",
      "source_type": "provincial_government",
      "accessed": "2026-10-30",
      "data_period": null,
      "methodology": null,
      "licence": null
    },
    {
      "url": "https://www.quebec.ca/en/government/policies-orientations/french-language/modernization-charter-french-language",
      "title": "Modernization of the Charter of the French language (last update 5 October 2026)",
      "publisher": "Gouvernement du Québec",
      "source_type": "provincial_government",
      "accessed": "2026-10-30",
      "data_period": null,
      "methodology": null,
      "licence": null
    }
  ],
  "units": null,
  "verification": {
    "status": "partially_verified",
    "confidence": "medium",
    "verified_by": "agent-01",
    "last_verified": "2026-10-30",
    "next_review": "2026-11-29",
    "notes": "quebec.ca course pages read through search extracts; Francisation Québec role from the fetched modernization page."
  },
  "responsible_agent": "agent-01",
  "limitations": "Bill 84 (national integration) was not researched in this pass.",
  "created": "2026-10-30",
  "updated": "2026-10-30"
}
