{
  "id": "nat-bc-property-transfer-tax",
  "category": "nat",
  "subcategory": "land transfer tax",
  "name": "British Columbia property transfer tax — general rates",
  "name_fr": null,
  "geo": {
    "province": "BC",
    "region": null,
    "city": null,
    "neighbourhood": null,
    "address": null,
    "coord_precision": "unknown",
    "coord_source": null
  },
  "description": "Tax on the fair market value of property at registration in British Columbia.",
  "attributes": {
    "brackets": [
      {
        "from": 0,
        "to": 200000,
        "rate_pct": 1
      },
      {
        "from": 200000,
        "to": 2000000,
        "rate_pct": 2
      },
      {
        "from": 2000000,
        "to": null,
        "rate_pct": 3
      }
    ],
    "further_residential_over_3m_pct": 2,
    "base": "fair market value"
  },
  "data_kind": "official_fact",
  "sources": [
    {
      "url": "https://www2.gov.bc.ca/gov/content/taxes/property-taxes/property-transfer-tax",
      "title": "Property transfer tax (last updated 3 December 2025)",
      "publisher": "Province of British Columbia",
      "source_type": "provincial_government",
      "accessed": "2026-10-30",
      "data_period": null,
      "methodology": null,
      "licence": "Province of British Columbia; Copyright and Disclaimer of gov.bc.ca (link and cite; reproduction terms per gov.bc.ca copyright page)"
    }
  ],
  "units": {
    "money": "CAD",
    "rates": "percent"
  },
  "verification": {
    "status": "verified",
    "confidence": "high",
    "verified_by": "agent-02",
    "last_verified": "2026-10-30",
    "next_review": "2027-01-15",
    "notes": "Read on 2026-10-30."
  },
  "responsible_agent": "agent-02",
  "limitations": "Exemptions (first-time buyers, newly built homes) reduce the tax; see nat-bc-first-time-home-buyers-exemption.",
  "created": "2026-10-30",
  "updated": "2026-10-30"
}
