{
  "id": "re-on-ottawa-cma-cmhc-rent-2bed-2025-10",
  "category": "re",
  "subcategory": "rental market survey",
  "name": "Ottawa — CMHC average rent, two-bedroom purpose-built apartment, October 2025",
  "name_fr": null,
  "geo": {
    "province": "ON",
    "region": null,
    "city": "Ottawa",
    "neighbourhood": null,
    "address": null,
    "coord_precision": "unknown",
    "coord_source": null
  },
  "description": "Survey average monthly rent for a two-bedroom unit in privately initiated purpose-built rental apartments, Ottawa CMA, from CMHC's October 2025 Rental Market Survey. Includes occupied and vacant units; not an asking rent.",
  "attributes": {
    "metric": "average_rent",
    "property_type": "purpose_built_rental",
    "bedrooms": "2",
    "value": 1926.0,
    "unit": "cad_per_month",
    "period": "2025-10",
    "geography_level": "cma",
    "geography_name": "Ottawa CMA",
    "figure_kind": "survey",
    "sample_size": null,
    "year_over_year_change_pct": 3.4,
    "notes": "CMHC Ottawa CMA, private apartments, two-bedroom: October 2024 average $1,880; October 2025 $1,926 (quality 'a', excellent). year_over_year_change_pct is CMHC's same-sample estimate of rent change (Table 1.1.5), quality 'b'. Universe: 34,653 two-bedroom units of 82,160 private apartment units."
  },
  "data_kind": "official_fact",
  "sources": [
    {
      "url": "https://assets.cmhc-schl.gc.ca/sites/cmhc/professional/housing-markets-data-and-research/housing-data-tables/rental-market/rental-market-report-data-tables/2025/rmr-ottawa-2025-en.xlsx",
      "title": "Rental Market Survey Data Tables, Ottawa CMA, 2025 (Tables 1.1.2 and 1.1.5)",
      "publisher": "Canada Mortgage and Housing Corporation (CMHC)",
      "source_type": "housing_agency",
      "accessed": "2026-10-30",
      "data_period": "2025-10",
      "methodology": "CMHC Rental Market Survey, October 2025: privately initiated purpose-built rental apartment structures of three or more units; survey of landlords/property managers; quality grades a–d, ** = suppressed.",
      "licence": "© Canada Mortgage and Housing Corporation. CMHC Terms and Conditions (https://www.cmhc-schl.gc.ca/about-us/terms-conditions): content may be copied, downloaded and printed for personal use; it may not otherwise be redistributed, republished or reproduced without CMHC's prior written consent. The same average-rent figures are republished by Statistics Canada (table 34-10-0133-01) under the Statistics Canada Open Licence."
    },
    {
      "url": "https://www150.statcan.gc.ca/t1/tbl1/en/tv.action?pid=3410013301",
      "title": "Table 34-10-0133-01, CMHC average rents for areas with a population of 10,000 and over — Ottawa-Gatineau, Ontario part, Ontario/Quebec, apartment structures of three units and over, two bedroom units (vector v3824166)",
      "publisher": "Statistics Canada",
      "source_type": "statistics_agency",
      "accessed": "2026-10-30",
      "data_period": "2025",
      "methodology": "Republication of the CMHC Rental Market Survey October figure; retrieved through the Web Data Service, value matches the CMHC table.",
      "licence": "Statistics Canada Open Licence (https://www.statcan.gc.ca/en/reference/licence); attribution 'Source: Statistics Canada' required."
    }
  ],
  "units": null,
  "verification": {
    "status": "verified",
    "confidence": "high",
    "verified_by": "agent-02",
    "last_verified": "2026-10-30",
    "next_review": "2026-12-29",
    "notes": "Value read from the CMHC Excel data table downloaded on 2026-10-30; cross-checked against Statistics Canada vector v3824166."
  },
  "responsible_agent": "agent-02",
  "limitations": "Average across all sitting tenants and vacant units, so it lags market (turnover) rents and asking rents. Excludes condominium rentals, secondary suites and houses. Survey month is October 2025; CMHC's October 2026 survey is expected around December 2026. Average, not median.",
  "created": "2026-10-30",
  "updated": "2026-10-30"
}
