{
  "id": "city-ab-calgary",
  "category": "city",
  "subcategory": "principal city",
  "name": "Calgary",
  "name_fr": null,
  "geo": {
    "province": "AB",
    "region": null,
    "city": "Calgary",
    "neighbourhood": null,
    "address": null,
    "lat": 51.084938,
    "lon": -114.081944,
    "coord_precision": "approximate",
    "coord_source": "Natural Earth v5.1.2 1:10m Populated Places (ne_10m_populated_places_simple), ne_id 1159151035",
    "extent": null
  },
  "description": "Calgary, Alberta. Principal-city point for the map.",
  "attributes": {
    "capital": null,
    "natural_earth": {
      "ne_id": 1159151035,
      "featurecla": "Populated place",
      "scalerank": 3,
      "labelrank": 2,
      "min_zoom": 4
    },
    "selection_rule": "Natural Earth Canadian populated place that is a national or provincial/territorial capital, or has pop_max >= 100000."
  },
  "data_kind": "official_fact",
  "sources": [
    {
      "url": "https://www.naturalearthdata.com/downloads/10m-cultural-vectors/10m-populated-places/",
      "title": "Natural Earth 1:10m Cultural Vectors — Populated Places",
      "publisher": "Natural Earth (North American Cartographic Information Society)",
      "source_type": "other",
      "accessed": "2026-10-30",
      "data_period": "v5.1.2",
      "methodology": "GeoJSON from https://github.com/nvkelso/natural-earth-vector/tree/v5.1.2/geojson; filtered and checked by map/app/scripts/fetch-natural-earth.mjs (point-in-polygon against ne_50m_admin_1_states_provinces).",
      "licence": "Public domain"
    }
  ],
  "units": null,
  "verification": {
    "status": "partially_verified",
    "confidence": "medium",
    "verified_by": "agent-05",
    "last_verified": "2026-10-30",
    "next_review": "2027-10-30",
    "notes": "Province checked by point-in-polygon against Natural Earth admin-1. Not yet cross-checked against Statistics Canada census subdivision boundaries (Phase 2)."
  },
  "responsible_agent": "agent-05",
  "limitations": "Gazetteer record only: name, representative point and capital status from Natural Earth. It carries no population, climate, housing or school facts; those belong to Agents 01–04 records. The point is Natural Earth's representative location at 1:10 million scale, not a surveyed city centre or a Statistics Canada boundary centroid; expect offsets of up to a few kilometres. Selected because Natural Earth lists it as a national or provincial/territorial capital or gives it pop_max >= 100000; Natural Earth population figures have no stated census vintage and are not reproduced here. The English name is Natural Earth's `name` field; official French names are not yet recorded (name_fr null).",
  "created": "2026-10-30",
  "updated": "2026-10-30"
}
