{
  "id": "nat-sk-provincial-nominee-program",
  "category": "nat",
  "subcategory": "immigration",
  "name": "Saskatchewan Immigrant Nominee Program (SINP)",
  "name_fr": "Programme Candidats immigrants pour la Saskatchewan",
  "geo": {
    "province": "SK",
    "region": null,
    "city": null,
    "neighbourhood": null,
    "address": null,
    "lat": null,
    "lon": null,
    "coord_precision": "unknown",
    "coord_source": null,
    "extent": "province or territory"
  },
  "description": "Skilled-worker streams of the Saskatchewan Immigrant Nominee Program (SINP) and whether they run through Express Entry (an Express Entry-aligned nomination adds 600 CRS points).",
  "attributes": {
    "jurisdiction": "Saskatchewan",
    "legal_status": "in force on the access date (provincial programme under a federal–provincial agreement)",
    "skilled_worker_streams": [
      {
        "stream": "International Skilled Worker — Employment Offer",
        "summary": "With a Saskatchewan job offer"
      },
      {
        "stream": "International Skilled Worker — Occupation In-Demand",
        "summary": "No job offer; Expression of Interest; at least 60/110 points; CLB 4; TEER 0–3 in-demand occupation not on the excluded list"
      },
      {
        "stream": "International Skilled Worker — Saskatchewan Express Entry",
        "summary": "Express Entry profile and job-seeker code; at least 60 points; TEER 0–3 in-demand occupation; $500 fee"
      },
      {
        "stream": "Talent Pathways (Agriculture, Health, Innovation and Tech)",
        "summary": "Sector pathways"
      }
    ],
    "express_entry_aligned": "Yes — Saskatchewan Express Entry sub-category",
    "notes": "At least 750 nominations in 2026 reserved for graduates of Saskatchewan institutions with a priority-sector job offer. Priority sectors: health care, agriculture, skilled trades, mining, manufacturing, energy, technology.",
    "federal_target_ref": "nat-ca-immigration-levels-plan-2026-2028 (PNP 91,500 in 2026, all provinces)",
    "status_dependency": "Eligibility depends on occupation (NOC/TEER), job offer, language scores and existing ties to the province — all unknown (USER-PROFILE.md; OPEN-QUESTIONS.md items 2, 4, 7)."
  },
  "data_kind": "official_fact",
  "sources": [
    {
      "url": "https://www.saskatchewan.ca/residents/moving-to-saskatchewan/live-in-saskatchewan/by-immigrating/saskatchewan-immigrant-nominee-program/browse-sinp-programs/applicants-international-skilled-workers/international-skilled-worker-saskatchewan-express-entry",
      "title": "International Skilled Worker: Saskatchewan Express Entry",
      "publisher": "Government of Saskatchewan",
      "source_type": "provincial_government",
      "accessed": "2026-10-30",
      "data_period": null,
      "methodology": null,
      "licence": null
    },
    {
      "url": "https://www.saskatchewan.ca/residents/moving-to-saskatchewan/live-in-saskatchewan/by-immigrating/saskatchewan-immigrant-nominee-program/browse-sinp-programs/applicants-international-skilled-workers/international-skilled-worker-occupations-in-demand",
      "title": "International Skilled Worker: Occupation In-Demand",
      "publisher": "Government of Saskatchewan",
      "source_type": "provincial_government",
      "accessed": "2026-10-30",
      "data_period": null,
      "methodology": null,
      "licence": null
    }
  ],
  "units": null,
  "verification": {
    "status": "partially_verified",
    "confidence": "medium",
    "verified_by": "agent-01",
    "last_verified": "2026-10-30",
    "next_review": "2026-11-29",
    "notes": "Read through search-engine extracts of the provincial programme's official pages, not fetched in full."
  },
  "responsible_agent": "agent-01",
  "limitations": "Stream rules change several times a year and intake is often by invitation only; read the provincial guide in force before applying.",
  "created": "2026-10-30",
  "updated": "2026-10-30"
}
