{
  "id": "school-bc-surrey-mountainview-montessori",
  "category": "school",
  "subcategory": "Excluded — public Montessori",
  "name": "Mountainview Montessori Elementary",
  "name_fr": null,
  "geo": {
    "province": "BC",
    "region": "Metro Vancouver",
    "city": "Surrey",
    "neighbourhood": "Guildford",
    "address": "15225 98 Avenue, Surrey, BC V3R 1J2",
    "lat": 49.180764,
    "lon": -122.799459,
    "coord_precision": "approximate",
    "coord_source": "BC Ministry school-location dataset 2025/2026"
  },
  "description": "Public Montessori elementary school operated by the Surrey School District (SD 36). Recorded only so that it is not re-added: public Montessori programmes are outside the private-school scope.",
  "attributes": {
    "website": "https://www.surreyschools.ca/",
    "models": [
      "montessori"
    ],
    "philosophy": null,
    "legal_status": {
      "label": "Public school (School District 36 Surrey)",
      "province_category": "Public school",
      "authority": "Board of Education of School District No. 36 (Surrey)",
      "registered": true,
      "publicly_funded": true,
      "inspected": null,
      "can_issue_provincial_diploma": null,
      "source_url": "https://catalogue.data.gov.bc.ca/dataset/95da1091-7e8c-4aa6-9c1b-5ab159ea7b42"
    },
    "institution_type": null,
    "ages": null,
    "grades": "Elementary",
    "language_of_instruction": [
      "English"
    ],
    "tuition": null,
    "campuses": [],
    "media_links": [],
    "advantages": [],
    "limitations": [],
    "qualifying": "excluded",
    "qualifying_reason": "Public school (SPEC §7 explicit exclusion: public alternative programmes, even when Montessori). The B.C. register also lists Eagle Harbour Montessori (SD 45 West Vancouver), Polaris Montessori (SD 57 Prince George) and Don Titus Montessori (SD 59) as public — all excluded on the same ground."
  },
  "data_kind": "official_fact",
  "sources": [
    {
      "url": "https://catalogue.data.gov.bc.ca/dataset/95da1091-7e8c-4aa6-9c1b-5ab159ea7b42",
      "title": "BC Schools – K-12 with Francophone Indicators (school locations, 2025/2026)",
      "publisher": "B.C. Ministry of Education and Child Care / DataBC",
      "source_type": "provincial_government",
      "accessed": "2026-10-30",
      "data_period": "2025-2026",
      "licence": "Open Government Licence – British Columbia"
    }
  ],
  "units": {
    "tuition": "CAD"
  },
  "verification": {
    "status": "verified",
    "confidence": "high",
    "verified_by": "agent-03",
    "last_verified": "2026-10-30",
    "next_review": "2027-10-30",
    "notes": "Register lists PUBLIC_OR_INDEPENDENT = Public School."
  },
  "limitations": "Exclusion record; not researched beyond status.",
  "responsible_agent": "agent-03",
  "created": "2026-10-30",
  "updated": "2026-10-30"
}
