{
 "id": "landform-ca-great-lakes-st-lawrence-lowlands",
 "category": "landform",
 "subcategory": "physiographic region",
 "name": "Great Lakes–St. Lawrence Lowlands",
 "name_fr": null,
 "geo": {
  "province": "CA",
  "region": null,
  "city": null,
  "neighbourhood": null,
  "address": null,
  "lat": null,
  "lon": null,
  "coord_precision": "unknown",
  "coord_source": null,
  "extent": "Southern Ontario and the St. Lawrence valley to the Gulf"
 },
 "description": "Plain-like lowlands bordering the Shield on the south-east from Lake Huron and Lake Erie to the Strait of Belle Isle, covered by glacial deposits. The West Lowland is split by the Niagara Escarpment; the Central Lowland between the Ottawa and St. Lawrence rivers is rarely above 150 m except for the Monteregian Hills; the East Lowland includes Anticosti and small Gulf coast areas. Small in area but home to most of Canada's population and farmland.",
 "attributes": {
  "physiographic_level": "region",
  "subregions": [
   "West Lowland (southern Ontario, split by the Niagara Escarpment)",
   "Central Lowland (Ottawa–St. Lawrence plain to beyond Québec city on the north shore; Monteregian Hills)",
   "East Lowland (Anticosti, Mingan, Gulf of St. Lawrence fringes, Newfoundland coastal lowland)"
  ],
  "provinces_territories": [
   "ON",
   "QC",
   "NL"
  ],
  "ecozone_named_in_source": "Mixedwood Plains (plains, some hills; mixed deciduous-evergreen forest; cool to mild, moist) – 168,000 km2",
  "notable_heights": [
   {
    "name": "Mont Brome (Monteregian Hills)",
    "elevation_m": 554
   },
   {
    "name": "Niagara Escarpment point (44°23′N, 80°14′W)",
    "elevation_m": 535
   }
  ]
 },
 "data_kind": "official_fact",
 "sources": [
  {
   "url": "https://atlas.gc.ca/phys/en/index.html",
   "title": "The Atlas of Canada – Physiographic Regions of Canada (map 1254A compiled by H.S. Bostock, 1967, with descriptive text)",
   "publisher": "Natural Resources Canada",
   "source_type": "federal_government",
   "accessed": "2026-10-30",
   "data_period": null,
   "methodology": null,
   "licence": "Open Government Licence – Canada"
  },
  {
   "url": "https://www150.statcan.gc.ca/n1/pub/16-201-x/2009000/t232-eng.htm",
   "title": "Table 1.4 Biophysical characteristics of terrestrial ecozones (Human Activity and the Environment 2009, archived; from the National Ecological Framework / Wiken et al. 1996)",
   "publisher": "Statistics Canada",
   "source_type": "statistics_agency",
   "accessed": "2026-10-30",
   "data_period": null,
   "methodology": null,
   "licence": "Open Government Licence – Canada"
  },
  {
   "url": "https://www150.statcan.gc.ca/n1/pub/11-402-x/2010000/chap/geo/tbl/tbl03-eng.htm",
   "title": "Table 15.3 Selected principal heights, by province and territory (Canada Year Book 2010, archived; source: NRCan Atlas of Canada)",
   "publisher": "Statistics Canada",
   "source_type": "statistics_agency",
   "accessed": "2026-10-30",
   "data_period": null,
   "methodology": null,
   "licence": "Open Government Licence – Canada"
  }
 ],
 "units": {
  "elevation": "m",
  "area": "km2",
  "distance": "km"
 },
 "verification": {
  "status": "verified",
  "confidence": "high",
  "verified_by": "agent-04",
  "last_verified": "2026-10-30",
  "next_review": "2027-10-30",
  "notes": null
 },
 "responsible_agent": "agent-04",
 "limitations": "Physiographic description summarised from the Atlas of Canada; the map dates from 1967 (Bostock) and boundaries are generalised at 1:5 million. Lat/lon not given because the record describes an extensive region, not a point. The population and farmland statement is agent-04 context, not Atlas text.",
 "created": "2026-10-30",
 "updated": "2026-10-30"
}