{
  "id": "nat-ca-residential-property-purchase-by-non-canadians",
  "category": "nat",
  "subcategory": "property",
  "name": "Federal ban on non-Canadians buying residential property",
  "name_fr": "Interdiction d'achat d'immeubles résidentiels par des non-Canadiens",
  "geo": {
    "province": "CA",
    "region": null,
    "city": null,
    "neighbourhood": null,
    "address": null,
    "lat": null,
    "lon": null,
    "coord_precision": "unknown",
    "coord_source": null,
    "extent": "country"
  },
  "description": "Federal law prohibits most non-Canadians from buying residential property in Canada until 1 January 2027, with exemptions that include some work-permit holders and properties outside census metropolitan areas and census agglomerations.",
  "attributes": {
    "jurisdiction": "federal (applies in every province; provincial taxes on foreign buyers are separate — Agent 02)",
    "legal_status": "in force; scheduled to end 1 January 2027 after the two-year extension in Budget Implementation Act 2024 (Bill C-69); no further extension found on 2026-10-30",
    "who_is_affected": "Non-Canadians — people who are neither Canadian citizens nor permanent residents (plus certain corporations)",
    "permanent_residents": "Not affected (not 'non-Canadians')",
    "work_permit_holders_exemption": "Exempt if at least 183 days remain on the work permit or work authorization on the purchase date and the person has not bought more than one residential property (2023 amendments; earlier Canadian work-experience and tax-filing conditions repealed)",
    "other_exemptions": [
      "Residential property outside a census metropolitan area or census agglomeration",
      "Purchase for development purposes",
      "Other categories in the Regulations not catalogued here (e.g. some students, refugees, spouses of Canadians)"
    ],
    "expiry": "2027-01-01",
    "status_dependency": "Whether the user may buy depends on status at purchase (citizen, PR, work-permit holder or none) — unknown (USER-PROFILE.md)."
  },
  "data_kind": "official_fact",
  "sources": [
    {
      "url": "https://www.laws-lois.justice.gc.ca/eng/regulations/SOR-2022-250/FullText.html",
      "title": "Prohibition on the Purchase of Residential Property by Non-Canadians Regulations, SOR/2022-250 (current to 21 June 2026; last amended 27 March 2023; via search extract)",
      "publisher": "Department of Justice Canada",
      "source_type": "legislation",
      "accessed": "2026-10-30",
      "data_period": null,
      "methodology": null,
      "licence": "Open Government Licence – Canada"
    },
    {
      "url": "https://www.canada.ca/en/department-finance/corporate/transparency/2024/nffn-part-3.html",
      "title": "Bill C-69 (Budget Implementation Act, 2024), Part 4 Division 1 — two-year extension of the ban to 1 January 2027 (via search extract)",
      "publisher": "Department of Finance Canada",
      "source_type": "federal_government",
      "accessed": "2026-10-30",
      "data_period": null,
      "methodology": null,
      "licence": "Open Government Licence – Canada"
    },
    {
      "url": "https://www.cmhc-schl.gc.ca/professionals/housing-markets-data-and-research/housing-research/consultations/prohibition-purchase-residential-property-non-canadians-act",
      "title": "Prohibition on the Purchase of Residential Property by Non-Canadians Act (overview; via search extract)",
      "publisher": "Canada Mortgage and Housing Corporation",
      "source_type": "housing_agency",
      "accessed": "2026-10-30",
      "data_period": null,
      "methodology": null,
      "licence": null
    }
  ],
  "units": null,
  "verification": {
    "status": "partially_verified",
    "confidence": "medium",
    "verified_by": "agent-01",
    "last_verified": "2026-10-30",
    "next_review": "2026-11-29",
    "notes": "Regulation and Finance pages read through search extracts. The expiry date is two months after the access date: re-check for an extension in December 2026."
  },
  "responsible_agent": "agent-01",
  "limitations": "Student and other exemptions not listed in full; read the Regulations before relying on an exemption.",
  "created": "2026-10-30",
  "updated": "2026-10-30"
}
